<?xml version="1.0" encoding="UTF-8"?>
<addonConfiguration xmlns:xsi="http://www.w3.org/2001/XMLSchema-instance"
                    xsi:noNamespaceSchemaLocation="addons.xsd">
  <!--
    Default add-ons file for a Lightspeed based Lucy.
    -->
  <addons>

    <include>lucy/addons_common.xml</include>

    <!--
      Add-ons or add-on configurations specific for when the Lightspeed map is the main view.
      -->

    <addon>
      <priority>data_consumer</priority>
      <name>Lightspeed Map</name>
      <class>com.luciad.lucy.addons.lspmap.TLcyLspMapAddOn</class>
      <configFile>lucy/lspmap/TLcyLspMapAddOn.cfg</configFile>
      <!--Don't check for the Lightspeed option, you should get an explicit license error
       when using this addon in LuciadLightspeed LM -->
    </addon>
    <addon>

      <priority>data_producer</priority>
      <name>ESRI ArcInfo ASCII Grid Format</name>
      <class>com.luciad.lucy.addons.arcinfoasciigrid.TLcyArcInfoASCIIGridFormatAddOn</class>
      <configFile>lucy/arcinfoasciigrid/TLcyArcInfoASCIIGridFormatAddOn.cfg</configFile>
    </addon>
    <addon>
      <!--
        Priority is 'late' to allow other add-ons to register workspace codecs before the
        first workspace is loaded.
      -->
      <priority>late</priority>
      <name>Workspace</name>
      <class>com.luciad.lucy.addons.workspace.TLcyWorkspaceAddon</class>
      <configFile>lucy/workspace/workspace_addon.cfg</configFile>
    </addon>

    <addon>
      <name>Hello World</name>
      <class>com.company.HelloWorldAddOn</class>
    </addon>

  </addons>

</addonConfiguration>
