<?xml version="1.0" encoding="UTF-8"?>
<addonConfiguration xmlns:xsi="http://www.w3.org/2001/XMLSchema-instance"
                    xsi:noNamespaceSchemaLocation="addons.xsd">
  <addons>
    
    <include>com/company/addons_gxy.xml</include>

    <addon>
      <name>Show ReadMe</name>
      <class>com.company.ShowReadMeAddOn</class>
      <configFile>com/company/DataRepositoryReadMe.cfg</configFile>
    </addon>
    <!--Add the data repository as the last addon, allowing the other addons
        to register their data source handlers and model decoders to the Lucy Environment-->
    <addon>
      <priority>9998</priority>
      <name>Data Repository</name>
      <class>com.company.DataRepositoryAddOn</class>
      <configFile>com/company/data_repository.cfg</configFile>
    </addon>



  </addons>
</addonConfiguration>